sqlplus>@cs440_hw71
sqlplus>-- Bhargav Sai Krishna, Ravuri
sqlplus>-- CS440
sqlplus>-- Assignment 7
sqlplus>-- March 16, 2015
sqlplus>-- MyID: bhravuri
sqlplus>
sqlplus>-- set serveroutput on;
sqlplus>-- problem 1
sqlplus>
sqlplus>drop trigger r_emp_after_trigger;
drop trigger r_emp_after_trigger
*
ERROR at line 1:
ORA-04080: trigger 'R_EMP_AFTER_TRIGGER' does not exist


sqlplus>
sqlplus>
sqlplus>create or replace trigger r_emp_after_trigger after insert or update of comm on emp for each row
  2  
  3  
  4  
  5  begin
  6  
  7  	 if to_number(to_char(sysdate,'HH24')) between 8 and 16 then
  8  
  9  
 10  	      update bonus set comm=:new.comm where ename=:new.ename;
 11  		  if  sql%notfound then
 12  		    insert into bonus(ename,job,sal,comm)  values (:new.ename,:new.job,:new.sal,:new.comm);
 13  		  end if;
 14  
 15  	 end if;
 16  end;
 17  /

Trigger created.

sqlplus>
sqlplus>select * from emp where empno=7900;
     EMPNO ENAME      JOB              MGR HIREDATE         SAL       COMM     DEPTNO
---------- ---------- --------- ---------- --------- ---------- ---------- ----------
      7900 JAMES      CLERK           7698 03-DEC-09        950                    30

sqlplus>
sqlplus>select * from bonus;

no rows selected

sqlplus>
sqlplus>update emp set comm=3000 where empno=7900;

1 row updated.

sqlplus>
sqlplus>select * from emp where empno=7900;
     EMPNO ENAME      JOB              MGR HIREDATE         SAL       COMM     DEPTNO
---------- ---------- --------- ---------- --------- ---------- ---------- ----------
      7900 JAMES      CLERK           7698 03-DEC-09        950       3000         30

sqlplus>
sqlplus>select * from bonus;

no rows selected

sqlplus>
sqlplus>update emp set comm=2500 where empno=7900;

1 row updated.

sqlplus>
sqlplus>select * from bonus;

no rows selected

sqlplus>
sqlplus>select * from emp where empno=7900;
     EMPNO ENAME      JOB              MGR HIREDATE         SAL       COMM     DEPTNO
---------- ---------- --------- ---------- --------- ---------- ---------- ----------
      7900 JAMES      CLERK           7698 03-DEC-09        950       2500         30

sqlplus>
sqlplus>
sqlplus>
sqlplus>rollback;

Rollback complete.

sqlplus>
sqlplus>rollback;

Rollback complete.

sqlplus>
sqlplus>select * from emp where empno=7900;
     EMPNO ENAME      JOB              MGR HIREDATE         SAL       COMM     DEPTNO
---------- ---------- --------- ---------- --------- ---------- ---------- ----------
      7900 JAMES      CLERK           7698 03-DEC-09        950                    30

sqlplus>
sqlplus>select * from bonus;

no rows selected

sqlplus>
sqlplus>drop trigger R_EMP_AFTER_TRIGGER;

Trigger dropped.

sqlplus>
sqlplus>-- problem 2
sqlplus>
sqlplus>drop trigger r_emp_before_trigger_sal;
drop trigger r_emp_before_trigger_sal
*
ERROR at line 1:
ORA-04080: trigger 'R_EMP_BEFORE_TRIGGER_SAL' does not exist


sqlplus>drop procedure mod_emp;

Procedure dropped.

sqlplus>create or replace procedure mod_emp(p_newsal in out emp.sal%type,p_oldcomm in emp.comm%type,p_newcomm out emp.comm%type,p_oldjob in emp.job%type,p_newjob in emp.job%type) is
  2  
  3  
  4  v_cap number;
  5  
  6  begin
  7  
  8  
  9  
 10  	     if lower(p_oldjob)='analyst' then
 11  	       v_cap:=4000;
 12  	     elsif lower(p_oldjob)='clerk' then
 13  	       v_cap:=1500;
 14  	      elsif lower(p_oldjob)='manager' then
 15  	       v_cap:=3500;
 16  	      elsif lower(p_oldjob)='salesman' then
 17  	       v_cap:=2000;
 18  	     end if;
 19  
 20  		     if p_newsal>v_cap then
 21  
 22  		     p_newcomm:=p_newsal-v_cap+p_oldcomm;
 23  			     p_newsal:=v_cap;
 24  			     if lower(p_newjob)<>lower(p_oldjob) then
 25  			 raise_application_error(-20100,'Job Modification Not Permitted');
 26  		     end if;
 27  		     end if;
 28  
 29  end mod_emp;
 30  /

Procedure created.

sqlplus>
sqlplus>
sqlplus>show errors
No errors.
sqlplus>
sqlplus>
sqlplus>create or replace trigger r_emp_before_trigger_sal before update of sal,job on emp for each row
  2  
  3  
  4  
  5  
  6  
  7  begin
  8  
  9  	     mod_emp(:new.sal,nvl(:old.comm,0),:new.comm,:old.job,:new.job);
 10  
 11  end;
 12  /

Trigger created.

sqlplus>
sqlplus>select * from emp where empno=7900;
     EMPNO ENAME      JOB              MGR HIREDATE         SAL       COMM     DEPTNO
---------- ---------- --------- ---------- --------- ---------- ---------- ----------
      7900 JAMES      CLERK           7698 03-DEC-09        950                    30

sqlplus>
sqlplus>update emp set sal=1300 where empno=7900;

1 row updated.

sqlplus>
sqlplus>select * from emp where empno=7900;
     EMPNO ENAME      JOB              MGR HIREDATE         SAL       COMM     DEPTNO
---------- ---------- --------- ---------- --------- ---------- ---------- ----------
      7900 JAMES      CLERK           7698 03-DEC-09       1300                    30

sqlplus>
sqlplus>rollback;

Rollback complete.

sqlplus>
sqlplus>
sqlplus>select * from emp where empno=7900;
     EMPNO ENAME      JOB              MGR HIREDATE         SAL       COMM     DEPTNO
---------- ---------- --------- ---------- --------- ---------- ---------- ----------
      7900 JAMES      CLERK           7698 03-DEC-09        950                    30

sqlplus>
sqlplus>update emp set sal=2300 where empno=7900;

1 row updated.

sqlplus>
sqlplus>select * from emp where empno=7900;
     EMPNO ENAME      JOB              MGR HIREDATE         SAL       COMM     DEPTNO
---------- ---------- --------- ---------- --------- ---------- ---------- ----------
      7900 JAMES      CLERK           7698 03-DEC-09       1500        800         30

sqlplus>
sqlplus>rollback;

Rollback complete.

sqlplus>
sqlplus>
sqlplus>select * from emp where deptno=30;
     EMPNO ENAME      JOB              MGR HIREDATE         SAL       COMM     DEPTNO
---------- ---------- --------- ---------- --------- ---------- ---------- ----------
      7499 ALLEN      SALESMAN        7698 20-FEB-09       1600        300         30
      7521 WARD       SALESMAN        7698 22-FEB-09       1250        500         30
      7654 MARTIN     SALESMAN        7698 28-SEP-09       1250       1400         30
      7698 BLAKE      MANAGER         7839 01-MAY-09       2850                    30
      7844 TURNER     SALESMAN        7698 08-SEP-09       1500          0         30
      7900 JAMES      CLERK           7698 03-DEC-09        950                    30

6 rows selected.

sqlplus>
sqlplus>update emp set job='manager',sal=4000 where empno=7900;
update emp set job='manager',sal=4000 where empno=7900
       *
ERROR at line 1:
ORA-20100: Job Modification Not Permitted
ORA-06512: at "BHRAVURI.MOD_EMP", line 25
ORA-06512: at "BHRAVURI.R_EMP_BEFORE_TRIGGER_SAL", line 3
ORA-04088: error during execution of trigger 'BHRAVURI.R_EMP_BEFORE_TRIGGER_SAL'


sqlplus>
sqlplus>select * from emp where empno=7900;
     EMPNO ENAME      JOB              MGR HIREDATE         SAL       COMM     DEPTNO
---------- ---------- --------- ---------- --------- ---------- ---------- ----------
      7900 JAMES      CLERK           7698 03-DEC-09        950                    30

sqlplus>
sqlplus>rollback;

Rollback complete.

sqlplus>
sqlplus>
sqlplus>select * from emp where deptno=30;
     EMPNO ENAME      JOB              MGR HIREDATE         SAL       COMM     DEPTNO
---------- ---------- --------- ---------- --------- ---------- ---------- ----------
      7499 ALLEN      SALESMAN        7698 20-FEB-09       1600        300         30
      7521 WARD       SALESMAN        7698 22-FEB-09       1250        500         30
      7654 MARTIN     SALESMAN        7698 28-SEP-09       1250       1400         30
      7698 BLAKE      MANAGER         7839 01-MAY-09       2850                    30
      7844 TURNER     SALESMAN        7698 08-SEP-09       1500          0         30
      7900 JAMES      CLERK           7698 03-DEC-09        950                    30

6 rows selected.

sqlplus>
sqlplus>update emp set sal=4000 where deptno=30;

6 rows updated.

sqlplus>
sqlplus>select * from emp where deptno=30;
     EMPNO ENAME      JOB              MGR HIREDATE         SAL       COMM     DEPTNO
---------- ---------- --------- ---------- --------- ---------- ---------- ----------
      7499 ALLEN      SALESMAN        7698 20-FEB-09       2000       2300         30
      7521 WARD       SALESMAN        7698 22-FEB-09       2000       2500         30
      7654 MARTIN     SALESMAN        7698 28-SEP-09       2000       3400         30
      7698 BLAKE      MANAGER         7839 01-MAY-09       3500        500         30
      7844 TURNER     SALESMAN        7698 08-SEP-09       2000       2000         30
      7900 JAMES      CLERK           7698 03-DEC-09       1500       2500         30

6 rows selected.

sqlplus>
sqlplus>rollback;

Rollback complete.

sqlplus>
sqlplus>rollback;

Rollback complete.

sqlplus>
sqlplus>select * from emp where deptno=30;
     EMPNO ENAME      JOB              MGR HIREDATE         SAL       COMM     DEPTNO
---------- ---------- --------- ---------- --------- ---------- ---------- ----------
      7499 ALLEN      SALESMAN        7698 20-FEB-09       1600        300         30
      7521 WARD       SALESMAN        7698 22-FEB-09       1250        500         30
      7654 MARTIN     SALESMAN        7698 28-SEP-09       1250       1400         30
      7698 BLAKE      MANAGER         7839 01-MAY-09       2850                    30
      7844 TURNER     SALESMAN        7698 08-SEP-09       1500          0         30
      7900 JAMES      CLERK           7698 03-DEC-09        950                    30

6 rows selected.

sqlplus>
sqlplus>select * from emp where empno=7900;
     EMPNO ENAME      JOB              MGR HIREDATE         SAL       COMM     DEPTNO
---------- ---------- --------- ---------- --------- ---------- ---------- ----------
      7900 JAMES      CLERK           7698 03-DEC-09        950                    30

sqlplus>
sqlplus>drop trigger R_EMP_BEFORE_TRIGGER_SAL;

Trigger dropped.

sqlplus>
sqlplus>-- problem 3
sqlplus>
sqlplus>
sqlplus>drop trigger r_p_before_trigger_weight;
drop trigger r_p_before_trigger_weight
*
ERROR at line 1:
ORA-04080: trigger 'R_P_BEFORE_TRIGGER_WEIGHT' does not exist


sqlplus>
sqlplus>create or replace trigger r_p_before_trigger_weight before insert or update of weight on p for each row when(new.weight>10)
  2  
  3  begin
  4  
  5  :new.color:='red';
  6  
  7  end;
  8  /

Trigger created.

sqlplus>
sqlplus>-- problem 4
sqlplus>
sqlplus>CREATE OR REPLACE TRIGGER comp_p_trig_after_wei FOR insert OR update of weight ON p  COMPOUND TRIGGER
  2  
  3   type p_ty is table of p%rowtype index by binary_integer;
  4   p_tab p_ty;
  5  
  6    AFTER EACH ROW IS
  7    BEGIN
  8  	     if :new.weight<8 then
  9  		     p_tab(p_tab.count+1).p#:= :new.p#;
 10  	     end if;
 11    END AFTER EACH ROW;
 12  
 13    AFTER STATEMENT IS
 14    BEGIN
 15  
 16  	     for cntr in 1..p_tab.count loop
 17  		 update p set color='blue'
 18  			where p#=p_tab(cntr).p#;
 19  	     end loop;
 20  
 21  	     p_tab.delete;
 22  
 23  	     exception
 24  	     when others then
 25  		     p_tab.delete;
 26  	     raise;
 27    END AFTER STATEMENT;
 28  
 29  END comp_p_trig_after_wei;
 30  /

Trigger created.

sqlplus>
sqlplus>select * from p where lower(p#)='p5';
P# PNAME      COLOR     WEIGHT CITY
-- ---------- ----- ---------- ----------
p5 wrench     green        2.6 Rome

sqlplus>
sqlplus>update p set weight=9 where lower(p#)='p5';

1 row updated.

sqlplus>
sqlplus>select * from p where lower(p#)='p5';
P# PNAME      COLOR     WEIGHT CITY
-- ---------- ----- ---------- ----------
p5 wrench     green          9 Rome

sqlplus>
sqlplus>rollback;

Rollback complete.

sqlplus>
sqlplus>update p set weight=14 where lower(p#)='p5';

1 row updated.

sqlplus>
sqlplus>select * from p where lower(p#)='p5';
P# PNAME      COLOR     WEIGHT CITY
-- ---------- ----- ---------- ----------
p5 wrench     red           14 Rome

sqlplus>
sqlplus>rollback;

Rollback complete.

sqlplus>
sqlplus>update p set weight=6 where lower(p#)='p5';

1 row updated.

sqlplus>
sqlplus>select * from p where lower(p#)='p5';
P# PNAME      COLOR     WEIGHT CITY
-- ---------- ----- ---------- ----------
p5 wrench     blue           6 Rome

sqlplus>
sqlplus>rollback;

Rollback complete.

sqlplus>
sqlplus>select * from p where lower(p#)='p5';
P# PNAME      COLOR     WEIGHT CITY
-- ---------- ----- ---------- ----------
p5 wrench     green        2.6 Rome

sqlplus>
sqlplus>drop trigger R_P_BEFORE_TRIGGER_WEIGHT;

Trigger dropped.

sqlplus>drop trigger COMP_P_TRIG_AFTER_WEI;

Trigger dropped.

sqlplus>spool off
